{
  "$schema": ".adwf/schemas/creative-agent-qualification-report.schema.json",
  "schema_version": 1,
  "adapter_id": "reference-local",
  "adapter_version": "1.0.0",
  "adapter_kind": "REFERENCE_DETERMINISTIC",
  "invocation_mode": "COMMAND",
  "qualification_profile_id": "CREATIVE_AGENT_COMMAND_V1",
  "qualification_profile_version": 1,
  "qualification_profile_digest": "426dee8fd5063bb8f408d6ec3ab26e7c67d9c4a2e8d91b09174cb407bd515af8",
  "adapter_digest": "80918ebd06923ec8463e8ec2c965cb763641603d7e5a0e295f1e6fbbee7bc2ec",
  "status": "PASS",
  "supported_phases": [
    "EXECUTE",
    "RECOVERY"
  ],
  "monetary_budget_usd": 0,
  "network": "NONE",
  "secrets": "FORBIDDEN",
  "filesystem": "PACKAGE_SCOPED",
  "exact_package_binding": true,
  "allowed_write_surface_enforced": true,
  "forbidden_write_surface_rejected": true,
  "changed_paths_verified": true,
  "result_contract_verified": true,
  "secret_environment_filtered": true,
  "stale_package_rejected": true,
  "timeout_fail_closed": true,
  "nonzero_exit_fail_closed": true,
  "missing_result_fail_closed": true,
  "low_trust_result": true,
  "real_external_agent_verified": false,
  "report_sha256": "af61a7f1d3d47ba70d9c092c4911868b496a189de02ed3b30930ad119e1662c8"
}
