{
  "$schema": ".adwf/schemas/creative-agent-qualification-report.schema.json",
  "schema_version": 1,
  "adapter_id": "openhands-local",
  "adapter_version": "1.0.0",
  "adapter_kind": "EXTERNAL_COMMAND",
  "invocation_mode": "COMMAND",
  "qualification_profile_id": "CREATIVE_AGENT_COMMAND_V1",
  "qualification_profile_version": 1,
  "qualification_profile_digest": "426dee8fd5063bb8f408d6ec3ab26e7c67d9c4a2e8d91b09174cb407bd515af8",
  "adapter_digest": "afeefcd7a4ee9b2d55cb22a42edb5135a43f503085bbb8620ac0970afb6ca89c",
  "status": "PASS",
  "supported_phases": [
    "EXECUTE",
    "RECOVERY"
  ],
  "monetary_budget_usd": 0,
  "network": "DECLARED_EXTERNAL",
  "secrets": "FORBIDDEN",
  "filesystem": "PACKAGE_SCOPED",
  "exact_package_binding": true,
  "allowed_write_surface_enforced": true,
  "forbidden_write_surface_rejected": true,
  "changed_paths_verified": true,
  "result_contract_verified": true,
  "secret_environment_filtered": true,
  "stale_package_rejected": true,
  "timeout_fail_closed": true,
  "nonzero_exit_fail_closed": true,
  "missing_result_fail_closed": true,
  "low_trust_result": true,
  "real_external_agent_verified": false,
  "report_sha256": "9b0e9da3a0043d0cf778c3d13de53d6432c29405cc171b177ceae8c7f9078e09"
}
